{
  "case_id": "assignment-n6-p3-s1",
  "classification": "harmless",
  "family": "assignment",
  "instance_digest": "sha256:6ed553782a546c81a643d6d57ae9624fef3bffd43f0f2dccc35d76601217e1eb",
  "protocol_sha256": "d7e0a1351722e8bc41a9ac64617b455bad30125c016ed52916c95804ba065aaa",
  "result": {
    "budget": "0",
    "challenger_ids": [
      "perm:4,0,3,2,1,5"
    ],
    "margin": "14/275",
    "master_certificate": {
      "active_rows": [
        2,
        3,
        4
      ],
      "equality_multipliers": [
        "0"
      ],
      "inequality_multipliers": [
        "0",
        "0",
        "1"
      ],
      "objective": "0",
      "point": [
        "1",
        "0",
        "0",
        "0"
      ],
      "status": "OPTIMAL"
    },
    "oracle_calls": 2,
    "oracle_proofs": [
      {
        "candidate_excluded": true,
        "column_potentials": [
          -275215,
          -37973,
          0,
          -30278,
          -74786,
          -140077
        ],
        "constraints": [
          7
        ],
        "excluded_subproblems": [],
        "integer_scale": 5933400,
        "minimum_score": "-84211/494450",
        "objective": [
          175,
          94,
          166
        ],
        "row_potentials": [
          483684,
          965041,
          653068,
          1296667,
          706884,
          631095
        ],
        "selected_forbidden_row": -1,
        "type": "assignment_integer_hungarian_dual"
      },
      {
        "candidate_excluded": true,
        "column_potentials": [
          0,
          -8,
          0,
          0,
          0,
          -2
        ],
        "constraints": [
          -7
        ],
        "excluded_subproblems": [
          {
            "forbidden_row": 0,
            "optimum": 100
          },
          {
            "forbidden_row": 1,
            "optimum": 82
          },
          {
            "forbidden_row": 2,
            "optimum": 82
          },
          {
            "forbidden_row": 3,
            "optimum": 65
          },
          {
            "forbidden_row": 4,
            "optimum": 114
          },
          {
            "forbidden_row": 5,
            "optimum": 65
          }
        ],
        "integer_scale": 275,
        "minimum_score": "14/275",
        "objective": [
          65,
          119,
          274
        ],
        "row_potentials": [
          19,
          14,
          10,
          15,
          1,
          16
        ],
        "selected_forbidden_row": 3,
        "type": "assignment_integer_hungarian_dual"
      }
    ],
    "parameters": {
      "budget": "0",
      "multipliers": [
        "0"
      ],
      "weights": [
        "1",
        "0",
        "0"
      ]
    },
    "retained_rows": 1,
    "status": "STRICTLY_CERTIFIED"
  },
  "schema": "mmor-minimum-budget-certificate-1.0"
}
