{
  "case_id": "explicit-p4-repairable-s101",
  "classification": "repairable",
  "family": "explicit_controlled",
  "instance_digest": "sha256:689a07baf189a7077163ba5e1fd6c1c7168067965430afa31cdd249769fe2724",
  "protocol_sha256": "d7e0a1351722e8bc41a9ac64617b455bad30125c016ed52916c95804ba065aaa",
  "result": {
    "budget": "4/19",
    "challenger_ids": [
      "core2",
      "core3",
      "core0",
      "core1"
    ],
    "margin": "0",
    "master_certificate": {
      "active_rows": [
        0,
        1,
        2,
        3
      ],
      "equality_multipliers": [
        "-4/19"
      ],
      "inequality_multipliers": [
        "12/19",
        "12/19",
        "24/19",
        "28/19"
      ],
      "objective": "4/19",
      "point": [
        "6/19",
        "7/19",
        "3/19",
        "3/19",
        "4/19"
      ],
      "status": "OPTIMAL"
    },
    "oracle_calls": 5,
    "oracle_proofs": [
      {
        "challengers_checked": 8,
        "minimum": "-1/12",
        "type": "explicit_enumeration"
      },
      {
        "challengers_checked": 8,
        "minimum": "-1/3",
        "type": "explicit_enumeration"
      },
      {
        "challengers_checked": 8,
        "minimum": "-1/6",
        "type": "explicit_enumeration"
      },
      {
        "challengers_checked": 8,
        "minimum": "-1/7",
        "type": "explicit_enumeration"
      },
      {
        "challengers_checked": 8,
        "minimum": "0",
        "type": "explicit_enumeration"
      }
    ],
    "parameters": {
      "budget": "4/19",
      "multipliers": [
        "4/19"
      ],
      "weights": [
        "6/19",
        "7/19",
        "3/19",
        "3/19"
      ]
    },
    "retained_rows": 4,
    "status": "CERTIFIED_MINIMUM_BUDGET"
  },
  "schema": "mmor-minimum-budget-certificate-1.0"
}
