{
  "case_id": "explicit-p4-harmless-s101",
  "classification": "harmless",
  "family": "explicit_controlled",
  "instance_digest": "sha256:efe800c78b65358e35a1ac8447c50d4cf606660739caa616a0323c0397c54b3b",
  "protocol_sha256": "d7e0a1351722e8bc41a9ac64617b455bad30125c016ed52916c95804ba065aaa",
  "result": {
    "budget": "0",
    "challenger_ids": [],
    "margin": "15/28",
    "master_certificate": {
      "active_rows": [],
      "equality_multipliers": [],
      "inequality_multipliers": [],
      "objective": "0",
      "point": [
        "1/4",
        "1/4",
        "1/4",
        "1/4",
        "0"
      ],
      "status": "OPTIMAL"
    },
    "oracle_calls": 1,
    "oracle_proofs": [
      {
        "challengers_checked": 8,
        "minimum": "15/28",
        "type": "explicit_enumeration"
      }
    ],
    "parameters": {
      "budget": "0",
      "multipliers": [
        "0"
      ],
      "weights": [
        "1/4",
        "1/4",
        "1/4",
        "1/4"
      ]
    },
    "retained_rows": 0,
    "status": "STRICTLY_CERTIFIED"
  },
  "schema": "mmor-minimum-budget-certificate-1.0"
}
