{
  "case_id": "path-w3-l5-p4-s5",
  "classification": "repairable",
  "family": "layered_shortest_path",
  "instance_digest": "sha256:5a61c235af7eed35300e8ad9c702ed69c6ffaa59c3a4223207d9ba5864e88c3f",
  "protocol_sha256": "d7e0a1351722e8bc41a9ac64617b455bad30125c016ed52916c95804ba065aaa",
  "result": {
    "budget": "15580/255441",
    "challenger_ids": [
      "path:e000001|e000007|e000016|e000024|e000032|e000041",
      "path:e000001|e000008|e000018|e000021|e000030|e000039",
      "path:e000001|e000008|e000018|e000021|e000031|e000040",
      "path:e000001|e000007|e000016|e000025|e000034|e000040",
      "path:e000001|e000007|e000016|e000024|e000031|e000040"
    ],
    "margin": "0",
    "master_certificate": {
      "active_rows": [
        2,
        3,
        4,
        6
      ],
      "equality_multipliers": [
        "-15580/255441"
      ],
      "inequality_multipliers": [
        "339112/766323",
        "819092/766323",
        "200086/766323",
        "23911343/38316150"
      ],
      "objective": "15580/255441",
      "point": [
        "393482/766323",
        "0",
        "2252920/5364261",
        "39663/596029",
        "15580/255441"
      ],
      "status": "OPTIMAL"
    },
    "oracle_calls": 6,
    "oracle_proofs": [
      {
        "candidate_excluded": true,
        "constraints": [
          35
        ],
        "distance_to_sink": 905494141,
        "excluded_subproblems": [],
        "integer_scale": 1151888400,
        "minimum_score": "-166608461/575944200",
        "objective": [
          95,
          121,
          106,
          76
        ],
        "selected_forbidden_edge": null,
        "type": "layered_dag_integer_potentials"
      },
      {
        "candidate_excluded": true,
        "constraints": [
          26
        ],
        "distance_to_sink": 60,
        "excluded_subproblems": [],
        "integer_scale": 151,
        "minimum_score": "-33/151",
        "objective": [
          132,
          233,
          60,
          194
        ],
        "selected_forbidden_edge": null,
        "type": "layered_dag_integer_potentials"
      },
      {
        "candidate_excluded": true,
        "constraints": [
          15
        ],
        "distance_to_sink": 6282,
        "excluded_subproblems": [],
        "integer_scale": 13382,
        "minimum_score": "-627/6691",
        "objective": [
          94,
          199,
          60,
          177
        ],
        "selected_forbidden_edge": null,
        "type": "layered_dag_integer_potentials"
      },
      {
        "candidate_excluded": true,
        "constraints": [
          26
        ],
        "distance_to_sink": 63,
        "excluded_subproblems": [],
        "integer_scale": 163,
        "minimum_score": "-16/163",
        "objective": [
          63,
          154,
          100,
          125
        ],
        "selected_forbidden_edge": null,
        "type": "layered_dag_integer_potentials"
      },
      {
        "candidate_excluded": true,
        "constraints": [
          29
        ],
        "distance_to_sink": 14863017,
        "excluded_subproblems": [],
        "integer_scale": 22002850,
        "minimum_score": "-1652601/22002850",
        "objective": [
          81,
          148,
          85,
          91
        ],
        "selected_forbidden_edge": null,
        "type": "layered_dag_integer_potentials"
      },
      {
        "candidate_excluded": true,
        "constraints": [
          15
        ],
        "distance_to_sink": 3607889,
        "excluded_subproblems": [],
        "integer_scale": 5364261,
        "minimum_score": "0",
        "objective": [
          94,
          199,
          60,
          177
        ],
        "selected_forbidden_edge": null,
        "type": "layered_dag_integer_potentials"
      }
    ],
    "parameters": {
      "budget": "15580/255441",
      "multipliers": [
        "15580/255441"
      ],
      "weights": [
        "393482/766323",
        "0",
        "2252920/5364261",
        "39663/596029"
      ]
    },
    "retained_rows": 5,
    "status": "CERTIFIED_MINIMUM_BUDGET"
  },
  "schema": "mmor-minimum-budget-certificate-1.0"
}
