{
  "case_id": "path-w3-l5-p2-s3",
  "classification": "harmless",
  "family": "layered_shortest_path",
  "instance_digest": "sha256:87ceede5a6931078eedcf0362f3e1cc7119071558b7bb3c4e19121885f82b1d6",
  "protocol_sha256": "d7e0a1351722e8bc41a9ac64617b455bad30125c016ed52916c95804ba065aaa",
  "result": {
    "budget": "0",
    "challenger_ids": [
      "path:e000000|e000005|e000020|e000027|e000030|e000039"
    ],
    "margin": "2/179",
    "master_certificate": {
      "active_rows": [
        2,
        3
      ],
      "equality_multipliers": [
        "0"
      ],
      "inequality_multipliers": [
        "0",
        "1"
      ],
      "objective": "0",
      "point": [
        "1",
        "0",
        "0"
      ],
      "status": "OPTIMAL"
    },
    "oracle_calls": 2,
    "oracle_proofs": [
      {
        "candidate_excluded": true,
        "constraints": [
          16
        ],
        "distance_to_sink": 28209,
        "excluded_subproblems": [],
        "integer_scale": 40096,
        "minimum_score": "-647/2506",
        "objective": [
          132,
          75
        ],
        "selected_forbidden_edge": null,
        "type": "layered_dag_integer_potentials"
      },
      {
        "candidate_excluded": true,
        "constraints": [
          43
        ],
        "distance_to_sink": 73,
        "excluded_subproblems": [
          {
            "forbidden_edge": "e000001",
            "optimum": 73
          },
          {
            "forbidden_edge": "e000008",
            "optimum": 73
          },
          {
            "forbidden_edge": "e000018",
            "optimum": 73
          },
          {
            "forbidden_edge": "e000021",
            "optimum": 73
          },
          {
            "forbidden_edge": "e000030",
            "optimum": 73
          },
          {
            "forbidden_edge": "e000039",
            "optimum": 101
          }
        ],
        "integer_scale": 179,
        "minimum_score": "2/179",
        "objective": [
          73,
          211
        ],
        "selected_forbidden_edge": "e000001",
        "type": "layered_dag_integer_potentials"
      }
    ],
    "parameters": {
      "budget": "0",
      "multipliers": [
        "0"
      ],
      "weights": [
        "1",
        "0"
      ]
    },
    "retained_rows": 1,
    "status": "STRICTLY_CERTIFIED"
  },
  "schema": "mmor-minimum-budget-certificate-1.0"
}
